renowned healing properties, anti-inflammatory and can soothe the skin and help heal
cuts, grazes, burns and insect bites. Its active constituents actually speed healing by
accelerating tissue repair and encouraging normal cell growth. These properties make it
ideal for use in skin care and cosmetic preparations on sunburns, acne dermatitis, and
otherwise sensitive and irritated skin.
独特的特质,给于干性,敏感性及损伤肌肤保湿、镇定及愈合效果。芦荟中的氨基
酸和复合多糖物质构成了天然保湿因素,它可以补充水份,恢复胶元蛋白的功能,
防止面部皱纹,保持皮肤柔润、光滑并富有弹性。芦荟中的某些成份能在皮肤上形成一层无形的膜,具消炎、加速细胞的愈合和生长,可防止因日晒引起的红肿、灼
热感,保护皮肤免遭灼伤。",,,,,,,"Apply to the face. Depending on the skin’s needs, apply on its own after daily skincare.
Massage into skin using gentle, upward strokes.
涂抹于面部。根据肌肤的需要,在日常护肤产品后涂抹。然后以轻柔,向上划的方
式按摩肌肤。",,,
22,Lift Up Essence ,"An innovative and high-performance essence is specially formatted to get rid
of puffiness, crow’s feet, dark circles and resist the pull of gravity. It
combats all causes and signs of slackening on the eyelids, eye corner and
face contour for a complete ""lifting"" and “firming” of the eye contours and
face contour. The eye and face contour is smoothed, lifted and visibly
younger looking. Therefore, its lightweight texture absorbs easily into the

skin, leaving your skin feeling velvety smooth.

一种创新与高性能的精华胶是特别为驱走眼袋、鱼尾纹、黑眼圈和抗
地心引力而研制。它对抗所有造成眼皮、眼角和脸部轮廓松弛的原因
与迹象为完善的眼部和脸部轮廓“提拉”及“紧实”。眼部和脸部轮廓是平
滑、提拉和明显地看起来更年轻。此外,其轻盈的质地,容易被肌肤

吸收,使肌肤犹如天鹅绒般地光滑。",in stock,new,428 MYR,https://www.example.com,,Girasol,Health & Beauty > Personal Care > Cosmetics,Health & Beauty > Beauty,1,,,,,,,"Perfluorodecalin
It acts as skin revitalize, refreshing the cells by bringing oxygen and simultaneously
removing cumulated pollution. It decreases the numbers of wrinkles, as well as the depth
of the wrinkles. It also moisturized skin and improves the appearance.
它作为振兴皮肤,刷新细胞中的氧气,同时消除累积已久的残污。它减少皱纹的数
量,以及对皱纹的深度。它也滋润皮肤并帮助改善外观。

Polyperfluoromethylisopropyl Ether
Perform as 作用:
• Skin protectants 皮肤保护剂
• Film formers膜成型
• Skin feel improvers皮肤感觉改良剂
• Moisture barriers保湿屏障
• Emollients润肤剂
• Water and oil repellents水和油剂
• Lubricants润滑剂
• Anti-adhesives反胶
• Wetting agents润湿剂

Dimethyl Sulfone
It is claimed to be anti-inflammatory and penetrate deep within the skin's surface to
moisturize, soften and rejuvenate dry, aging, or damaged skin.
它能抗炎和深入渗透皮肤达到滋润,并帮助软化、修复干燥、老化以及受损的皮
肤。

Complex of Retinyl Palmitate and Helianthus Annuus (Sunflower) Seed Oil
An important element to the growth of cells. Gently pampers newly born skin, treats acne
and anti-aging, lifts and firms skin density, smoothes over the depth of wrinkles. Skin
looks younger than your actual age.
维他命 A 是皮肤细胞生长的重要因素。对新生皮肤的形成有良好的效果,因此增
进皮肤的外表,使细纹及皱纹变得更平滑。

Panthenol
Pro-vitamin B5 that improves and increases the moisture-retaining ability of the skin
(long lasting moisturizer), dry skin remains supple and elastic for longer time; has a
wound healing effect, improves normal keratinization of the skin, stimulates
epithelization.
泛醇,也称为维他命原B5,改善及提升肌肤保湿作用,提供持久保湿感。使干燥
肌肤保持柔嫩及有弹性。也有疗伤疤功效,改善皮肤的角质化。

3-o-Ethyl Ascorbic Acid
It is an entered derivative of ascorbic acid, most excellent derivative of ascorbic acid so
far. It is very stable in the chemical structure, a real stable and discolored derivative of
ascorbic acid, but also it can enter into skin and be metabolized by body as ascorbic acid.
So its effect is better than pure ascorbic acid. It is a unique lipophilic and hydrophilic
material, easily be used in cosmetic formulation. It is most important that it can easily
enter into dermis and bring into play biological effect, while pure ascorbic acid almost
does not enter dermis. It is an excellent choice for cosmetic chemists.
它是抗坏血酸 ethered 衍生物,最优秀的抗坏血酸衍生物至今。这是非常稳定的化
学结构,真正的稳定和变色衍生公积金抗坏血酸,而且它可以进入皮肤,并作为抗
坏血酸身体代谢。因此,其效果优于单纯抗坏血酸。这是一个独特的亲脂和亲水性
物质,很容易在化妆品配方使用。最重要的是,它可以很容易地进入真皮和发挥生
物学效应,而纯维生素 C 除颤几乎没有进入真皮。这是一个化妆品化学家的最佳
选择。
The character of Ethyl Ascorbic Acid:
乙基抗坏血酸的特性:
 Excellent whitening effect: inhibit the activity of Tyrosine
卓越的美白作用: 抑制酪氨酸酶的活性
 High anti-oxidation 高抗氧化
 Stable derivative of ascorbic acid 稳定的维生素 C 衍生物
 Lipophilic and hydrophilic structure 亲油性和亲水性结构
 Anti-inflammation, inhibit the growth of bacteria 抗炎,抑制细菌的生长
 Improve the complexion, endow the elasticity of skin
改善肤色,赋予皮肤的弹性
 Repair the skin cell, accelerate the synthesis of collagen
修复皮肤细胞,促进胶原的合成
~ Whitening effect 美白作用:
Generally speaking, ascorbic acid can inhibit the synthesis of melanin. But the
effect of direct using ascorbic acid to skin is very bad. Clinical tests of human
and animal prove: cosmetic product containing 2% can improve the complexion
and whiten the skin. The mechanism is:
一般来说,维生素 C 可以抑制黑色素的合成。但是,直接利用抗坏
血酸于皮肤的后果是很恶劣的。人和 动物的临床试验证明:化妆品
含 2%可以改善肤色及美白皮肤。机制是:
-Action one: deoxidize the oxided jet black melanin into tint melanin
作用 1:还原的氧化物喷射黑色素进入色彩色素
-Action two: Inhibit the activity of Tyrosine, prevent the synthesis of
melanin
作用二:抑制酪氨酸酶的活性,阻止黑色素的合成
~ The synthesis of collagen
Ethyl Ascorbic Acid can repair the activity of collagen (repair the structure
and synthesis), improve the formation of skin cell and collagen according to
the ratio of metabolic consumption. Its activity is similar to ascorbic acid
phosphate derivative.
乙基抗坏血酸可以修复胶原蛋白的活性(修复的结构和合成),按代
谢消耗的比例改善皮肤细胞和胶原的形成。其活动类似抗坏血酸磷酸
酯衍生。
~ Antioxidation 抗氧化
Cosmetic products contain plentiful oil, so they are easily oxidized by UV
radiation, high temperature and humid atmosphere. When overdue or
improperly stored, these products can be irritant to skin. Therefore,
cosmetic manufacturers usually add BHT, BHA and Tocopherol, etc. But
these antioxidations are oil soluble and not easily metabolized by body.
Ethyl Ascorbic Acid is a high effective lipophilic and hydrophilic
antioxidant, it can decrease the occurrence of oil oxidation, and prevent
cosmetic deteriorate.
化妆品含有丰富的油,因此它们很容易被紫外线,高温和潮湿的空气
氧化。当过期或不正确存储,这些产品可刺激皮肤。因此,化妆品
制造商通常添加甲苯,BHA 和维生素等,但这些抗氧化是油溶性和
不容易被人体产生代谢变化。乙基抗坏血酸是一种高效的亲油性和亲
水性抗氧化剂,可减少油氧化的发生及防止化妆品毁坏。
~ Anti-inflammation 抗炎
Ethyl Ascorbic Acid has strong anti-inflammation effect.
乙基抗坏血酸具有较强的抗炎作用。

Tocopheryl Acetate
A kind of vitamin E, well refined anti-oxidant for human skin, fights against destructive
effects of free radicals on skin cells, as well as a primary defender against oxidation and
defender against lipid peroxidation and maintains the integrity of connective tissues.
Besides, it also possesses sunscreening abilities, therefore, protects skin from harmful UV
rays. At the same time, it locks in moisture, improves skin dehydration and progressively
reduces the appearance of fine lines.
维他命 E 的一种,人体主要之抗氧化剂,帮助对抗自由基造成的细胞损害,亦能
有效对抗脂质氧化,有助于维持结缔组织。此外,具有过滤紫外线功能,保护皮肤
遭阳光损伤。同时提升肌肤的锁水功能,让肌肤得到深层的湿润,改善老化干燥、
缺水的状况,减少细纹的产生。

Hyaluronic Acid
It is a structural component throughout the body and often touted for its abilities to stop
or reverse aging. Its outstanding moisture retaining capacity helps skin to absorb
hydration up to approximately 1000 times of its weight. It increases the elasticity and
lubricity of the skin, promoting immediate lifting results.
这是身体结构性的一种组成部分。它具有“保湿天后”美誉、高效保湿分子:玻尿
酸有""倒流岁月""和停止老化的功效。它彻底锁住水分,预防皮肤水分的流失,让皮
肤角质层保持膨润。从而提升眼周皮肤的弹力和光滑度,有立即紧实效果。
Key benefits 主要作用:
 It moisturizes the skin from the inside to smooth out the depth of wrinkles and
lines.
它深入滋润皮肤以抚平皱纹与细纹的深度。
 It helps to erase the signs of aging or who are beginning to see the first signs of
aging.
有助于消除初步的老化迹象。
 Immediate lifting effect helps increase firmness of the skin, to keep skin supple
and more elastic.
立即的拉提效果有助于提升皮肤的紧实度,让皮肤保持柔软、有弹力。

Allantoin
It promotes cell-regeneration in skin which has been subjected to the harsh treatment of
external influences, and in addition takes care of intact facial and body skin, keeping it in

a healthy condition. Allantoin is healing, soothing and anti-irritating. It is valuable cell-
prolifering healing agent which stimulates healthy tissue formation.

曾获称为抗刺激剂,有助减轻香皂、表面活化剂,油类及酸、碱材料等所带来的
不适效应。据称可清理坏死组织,加速新的健康组织的成长,加强肌肤的自癒功
能,维持肌肤的健康。

Hydrogenated Lecithin
Lecithin is one of the most important components of a cell and plays an important role in
its metabolism, especially in its constitution and membrane penetrability. For many years
its use as a bio-surfactant in cosmetics has been studied. However, its application to
cosmetics has been limited because of its oxidation and instability against heat.
卵磷脂是细胞中最重要的组成部分之一,同时其也在细胞代谢方面发挥重要作用,
尤其是在细胞结构和膜渗透性。多年来,对它用作为化妆品中的生物表面活性剂已
进行了研究。但是由于它面对热时会氧化且不稳定性,因此使得其在化妆品中的应
用受到了限制。
Hydrogenated Lecithin retains all the good qualities of natural lecithin, yet its stability is
greatly improved. Moreover, unlike common surfactants, Hydrogenated Lecithin forms
stable liposomes when it is dispersed in water, which can be involved both water-soluble
and lipo-soluble substances.
氢化卵磷脂保留了所有天然卵磷脂的良好品质,而且其稳定性也大为提高。此外,
不同于常见的表面活性剂,当氢化卵磷脂被分散在水中时会形成稳定的脂质体,它
能够被水溶性和脂溶性物质包容。
-Natural derived emulsifier (from soy). 自然衍生乳化剂(从大豆)。
-Liposome former. 脂质体。
-Promotes percutaneous absorption of actives. 促进皮肤吸收的活性。
-Moisturizing effect. 保湿功效。
-Enhances skin barrier function. 强化肌肤屏障功能。
-Reduces skin irritation. 降低皮肤刺激性。
-Dispersant for pigments. 颜料分散剂。",,,,,,,"After cleansing and toning, massage gently with fingertips in upward motion from the
inner to the outer part of the face and eye area. Use twice daily.
洗洁与爽肤后,用指腹轻轻地由内至外并往上地按摩于脸部和眼睛周围。每日使用
两次。",,,
23,Apple Stem Hydro Moist Elixer Lotion,"This intensive silky lotion is designed for middle-aged people between 35-50 years old. This lotion provides a light and smooth texture, and has no discomfort after application. It will minimized the appearance of fine lines and wrinkles, increases the firmness and elasticity of the skin, keep skin supple and more elastic. Additionally, it also restores the skin's delicate equilibrium while delivering essential hydration and provides brightening & calming effects. Your skin will be restoring more firm, smooth and younger with constant use.

这款强效的丝滑乳液专为 35 岁至 50 岁之间的中年人群而设计。 这种乳液质地轻盈柔滑,使用不会感到不适。 它将减少细纹和皱纹的出现,增加皮肤的紧致度和弹性,保持皮肤柔滑和更有弹性。 此外,它还可以恢复皮肤的细腻平衡,同时提供必要的水合作用,并提供美白和镇静的功效。 持续使用, 您的皮肤将恢复更加紧致,柔嫩和年轻的状态。",in stock,new,308 MYR,https://www.example.com,,Girasol,Health & Beauty > Personal Care > Cosmetics,Health & Beauty > Beauty,1,,,,,,,"**SODIUM ACRYLATES CROSSPOLYMER-2**
Sodium salt of acrylic copolymer. It is the absorbent powder which holds water more than 20
times of its dry weight and forms viscous emulsions and gels. The formulation with Sodium
Acrylates Crosspolymer-2 release water when applied on skin and provide a unique sensation of watery touch with elastomer-like finish. It exhibits soft-focus properties that provide an instantly visible blurring effect. This unique sensation is particularly interesting in improving the aesthetics of water-in-oil formulas that might have a heavy texture due to high load of chemical sunscreens and oils. It is suggested for use in skin care product but also as a powder for make-up products.
丙烯酸共聚物的钠盐。 吸水性粉末可保持水的干重超过 20 倍,形成粘稠的乳液和凝胶。
含有 Sodium Acrylates Crosspolymer-2 的配方可以在皮肤上使用时释放水分,并提供独特
的水润感,具有弹性体般的光洁度。 它具有柔焦特性,可提供即时可见的模糊效果。 这
种独特的感觉特别有趣的是改善由于化学防晒剂和油的高负荷而可能具有重质地的油包水
配方的美感。 建议用于护肤产品,也可用作化妆品的粉末。

**Hyaluronic Acid**
It is a structural component throughout the body and often touted for its abilities to stop or
reverse aging. Its outstanding moisture retaining capacity helps skin to absorb hydration up to approximately 1000 times of its weight. It increases the elasticity and lubricity of the skin,
promoting immediate lifting results.

这是身体结构性的一种组成部分。它具有“保湿天后”美誉、高效保湿分子:玻尿酸有""倒
流岁月""和停止老化的功效。它彻底锁住水分,预防皮肤水分的流失,让皮肤角质层保持
膨润。从而提升眼周皮肤的弹力和光滑度,有立即紧实效果。
**Key benefits 主要作用:**
- It moisturizes the skin from the inside to smooth out the depth of wrinkles and lines.
它深入滋润皮肤以抚平皱纹与细纹的深度。
- It helps to erase the signs of aging or who are beginning to see the first signs of aging.
有助于消除初步的老化迹象。
- Immediate lifting effect helps increase firmness of the skin, to keep skin supple and more
elastic.
立即的拉提效果有助于提升皮肤的紧实度,让皮肤保持柔软、有弹力。

**Niacinamide**
As a precursor of NAD (nicotinamide adenosine dinucleotide), an important molecule involved in energy metabolism, an effective skin lightener that works by inhibiting melanosome transfer from melanocytes to keratinocytes.
作为 NAD(烟酰胺腺嘌呤二核苷酸)的前体,一种参与能量代谢的重要分子,一种通过
抑制黑素细胞从黑素细胞转移至角质形成细胞而起作用的有效皮肤增白剂。

**Galactomyces Ferment Filtrate**

It is an excellent product for instant hydration. Besides the hydration, it also provides anti-
oxidant, anti-inflammatory and brightening benefits to our skin. It will also add “glowy” appearance to your skin. Your skin will be plumped up, hydrated and it will help your skin to
better absorb the following products that you are going to apply.
它是一款能即时保湿的卓越活性成份。除了保湿之外,还提供抗氧化、抗炎和美白皮肤的
作用。它还给您肌肤添加了活力。您的肌肤将变得饱满水润,另外它也会帮助皮肤更好地
吸收您随即将使用的产品。

**Malus Domestica Fruit Cell Culture Extract (Apple Stem Cells)**
It has age-delaying and anti-wrinkle effects. Thus, it is a revolutionary anti-aging active
ingredient based on a high-tech plant cell culture technology.
它具有延缓年龄和抗皱的效果。由此,以一个高科技植物细胞培养技术为基础,使它成为
一种具革命性的抗衰老活性成分。
• Protects longevity of skin stem cells 保护皮肤干细胞的寿命
• Delays senescence of essential cells 延缓主要细胞衰老
• Combats chronological aging 对抗时间性的衰老
• Preserves the youthful look and the vitality of your skin
维持您的年轻外观和皮肤活力

**Dipotassium Glycyrrhizate**
It is a natural active obtained from the extraction of licorice root, which acts as skin lightener,
anti-inflammation and anti-allergy agent.
它是一种萃取自甘草的天然活性成份,能作为皮肤美白剂、抗炎及抗过敏剂。
Dipotassium Glycyrrhizate is effective in treating acute and chronic dermatitis, and its milder
action gives almost no side effect to the skin. Besides, it also has the following actions:
Dipotassium Glycyrrhizate.

能有效地治疗急性及慢性皮炎,其性质温和,对皮肤几乎没有
副作用。

此外,它还具有以下作用:
- Inhibitory effect on hyaluronidase activity 抑制玻尿酸酶活性
- Inhibition on hyaluronidase activity plays an important role not only in maintaining the
hyaluronic acid level in the body but also anti-inflammatory and anti allergic activities.
在抑制玻尿酸酶活性方面发挥了重要作用,不仅维持身体中的玻尿酸水平,而且还
具有抗炎及抗过敏活性。
- Inhibitory effect on tyrosinase activity 抑制酪氨酸酶活性
- Inhibition on the formation of melanin effectively helps skin to maintain its brighter
complexion.
抑制黑色素的形成,能有效帮助皮肤保持其亮白的肤色。
- Preventative effect on UV-B induced erythema
有效预防由 UV - B 辐射引起的红斑

**Betaine**
-Strengthens skin barrier 加强皮肤屏障
-Mitigates irritation of surfactants 减轻表面活性剂的刺激
-Reduces stickiness 减少粘性
-Provides smoother, softer skin feel 提供皮肤更柔滑的感觉
-Maintains skin moisture balance 保持皮肤的水分平衡

**Aloe Barbadensis Leaf Juice**
Aloe Vera improves hydration, is soothing and healing to all skin types. Chemical analysis has
shown the presence of mucopolysacharides, a natural moisturizing factor. Aloe Vera is
composed of water, the enzymes catalase and cellulose, minerals, calcium, aluminium, iron, zinc, magnesium, sodium, 20 amino acids and carbohydrates. It has renowned healing properties, anti- inflammatory and can soothe the skin and help heal cuts, grazes, burns and insect bites. Its active constituents actually speed healing by accelerating tissue repair and encouraging normal cell growth. These properties make it ideal for use in skin care and cosmetic preparations on sunburns, acne dermatitis, and otherwise sensitive and irritated skin.
独特的特质,给于干性,敏感性及损伤肌肤保湿、镇定及愈合效果。芦荟中的氨基酸和复
合多糖物质构成了天然保湿因素,它可以补充水份,恢复胶元蛋白的功能,防止面部皱
纹,保持皮肤柔润、光滑并富有弹性。芦荟中的某些成份能在皮肤上形成一层无形的膜,
具消炎、加速细胞的愈合和生长,可防止因日晒引起的红肿、灼热感,保护皮肤免遭灼
伤。

**Allantoin**
It promotes cell-regeneration in skin which has been subjected to the harsh treatment of external influences, and in addition takes care of intact facial and body skin, keeping it in a healthy condition. Allantoin is healing, soothing and anti-irritating. It is valuable cell-prolifering healing agent which stimulates healthy tissue formation.
它促进皮肤的细胞再生,尤其是一直受到外部刺激的皮肤,此外还保护脸部和身体的皮
肤,使其保持健康状态。 尿囊素具有愈合,舒缓和抗刺激作用。 它是优越的细胞增生修
复剂,可刺激健康组织的形成。

**Citrus Paradisi (Grapefruit) Peel Oil**
Anti cellulite, circulatory stimulant and detoxify.
抗蜂窝组织,促进血液循环及帮助排毒。
It is uplifting and refreshing. It regulates sebum, for congested and oily skin.
提振精神、清新作用。调节皮脂分泌,调理油腻不洁皮肤。

**Epilobium Angustifolium Extract**
It provides safe, natural plant-derived functionality. It possesses anti-irritation, antibacterial and anti-acne properties. It is also free radical scavenger.
具有有效抗炎特性。提供安全、全天然形成功效。有抗敏、抗菌、抗粉刺及对抗自由基功
能。",,,,,,,"Apply an adequate amount over face especially line and wrinkles. Then, gently massage with
fingertips in upward motion from the inner to the outer part of the face to help skin absorbs.
取适量涂于脸部,尤其是细纹和皱纹部位。 然后,用指尖从面部的内部至外部轻轻向上
按摩,以帮助皮肤吸收。",,,
24,Soothing Gel ,"This intensive soothing gel contains soothing and calming properties to
moisturize, sooth & calms the skin. It will leave you a soft, calm and healthy

complexion with regularly usage.

这强效的舒缓凝胶含有舒缓和镇静性能以滋润,舒缓及镇静皮肤。经

常使用,它会让您拥有柔滑,镇静及健康的肤色。",in stock,new,121 MYR,https://www.example.com,,Girasol,Health & Beauty > Personal Care > Cosmetics,Health & Beauty > Beauty,1,,,,,,,"Camellia Sinensis Leaf Extract
Green tea is made from the dried leaves of Camellia sinensis, a perennial evergreen shrub.
Green tea has a long history of use, dating back to China approximately 5,000 years ago.
绿茶是由干茶树叶所得,是一年常青的灌木。绿茶具有悠久的历史,最早可追溯到
中国 5000 年前。
Because of the presence of Caffeine and theophylline, Tea is an encophalic and
cardiorespiratory stimulant. It enhances intellectual and muscular activity, accelerates
breathing and strengthens and settles the heartbeat. The presence of polyphenolic
derivates gives Tea a softer but more prolonged action than caffeine.
茶含有咖啡因和茶碱,能刺激脑部及心肺功能。它增强智力及肌肉的活动,促进呼
吸顺畅以及加强和改善心跳不规律。与咖啡因相比,茶内含有的多酚类衍生物更能
让茶自身的功效发挥得更长久。
In cosmetic, Green Tea is incorporated into cellulite products due to the presence of
polyphenolic compounds which act in the first place as astringents, protecting the skin
and reducing inflammation in the affected area. Besides, it is also an antioxidant which
protects skin from harmful free radical in the body.
在护肤品这方面,绿茶因含有多酚常被用于对抗蜂窝组织的减肥产品中,主要作为
收敛剂,保护皮肤,及减少伤口受感染。此外,也是抗氧化剂,保护皮肤对抗体内
的自由基。
Some studies found that Green tea helps delay skin cells aging, firms skin and balances
tone due to the presence of its antioxidant and anti-inflammatory activities, and green tea
polyphenols are likely to slow down the development of some signs of aging.
一些研究发现,绿茶的抗炎化和抗炎作用有助于延缓皮肤细胞的老化,紧实及调理
皮肤,绿茶的多酚也有放慢老化迹象的潜质。

Aloe Barbadensis Leaf Juice
Aloe Vera improves hydration, is soothing and healing to all skin types. Chemical
analysis has shown the presence of mucopolysacharides, a natural moisturizing factor.
Aloe Vera is composed of water, the enzymes catalase and cellulose, minerals, calcium,
aluminium, iron, zinc, magnesium, sodium, 20 amino acids and carbohydrates. It has
renowned healing properties, anti-inflammatory and can soothe the skin and help heal
cuts, grazes, burns and insect bites. Its active constituents actually speed healing by
accelerating tissue repair and encouraging normal cell growth. These properties make it
ideal for use in skin care and cosmetic preparations on sunburns, acne dermatitis, and
otherwise sensitive and irritated skin.
独特的特质,给于干性,敏感性及损伤肌肤保湿、镇定及愈合效果。芦荟中的氨基
酸和复合多糖物质构成了天然保湿因素,它可以补充水份,恢复胶元蛋白的功能,
