# Required | A unique content ID for the item. Use the item's SKU if you can. Each content ID must appear only once in your catalog. To run dynamic ads this ID must exactly match the content ID for the same item in your Meta Pixel code. Character limit: 100,# Required | A specific and relevant title for the item. See title specifications: https://www.facebook.com/business/help/2104231189874655 Character limit: 150,# Required | A short and relevant description of the item. Include specific or unique product features like material or color. Use plain text and don't enter text in all capital letters. See description specifications: https://www.facebook.com/business/help/2302017289821154 Character limit: 9999,# Required | The current availability of the item. | Supported values: in stock; out of stock | Supported values: in stock; available for order; preorder; out of stock; discontinued,# Required | The condition of the item. Enter one of the following: new; refurbished; used | Supported values: new; refurbished; used,# Required | The price of the item. Format the price as a number followed by the 3-letter currency code (ISO 4217 standards). Use a period (.') as the decimal point; don't use a comma.,# Required | The URL of the specific product page where people can buy the item.,# Required | The URL for the main image of your item. Images must be in a supported format (JPG/GIF/PNG) and at least 500 x 500 pixels.,# Required | The brand name of the item. You can also enter a unique manufacturer part number (MPN) or Global Trade Item Number (GTIN) instead. A GTIN can be one of the following: UPC; EAN; JAN; ISBN. Character limit: 100.,# Optional | The Google product category for the item. Learn more about product categories: https://www.facebook.com/business/help/526764014610932.,# Optional | The Facebook product category for the item. Learn more about product categories: https://www.facebook.com/business/help/526764014610932.,# Optional | The quantity of this item you have to sell on Facebook and Instagram with checkout. Must be 1 or higher or the item won't be buyable,# Optional | The discounted price of the item if it's on sale. Format the price as a number followed by the 3-letter currency code (ISO 4217 standards). Use a period () as the decimal point; don't use a comma. A sale price is required if you want to use an overlay for discounted prices.,# Optional | The time range for your sale period. Includes the date and time/time zone when your sale starts and ends. If this field is blank any items with a sale_price remain on sale until you remove the sale price. Use this format: YYYY-MM-DDT23:59+00:00/YYYY-MM-DDT23:59+00:00. Enter the start date as YYYY-MM-DD. Enter a 'T'. Enter the start time in 24-hour format (00:00 to 23:59) followed by the UTC time zone (-12:00 to +14:00). Enter '/' and then repeat the same format for your end date and time. The example row below uses PST time zone (-08:00).,# Optional | Use this field to create variants of the same item. Enter the same group ID for all variants within a group. Learn more about variants: https://www.facebook.com/business/help/2256580051262113 Character limit: 100.,# Optional | Shipping details for the item. Format as Country:Region:Service:Price. Include the 3-letter ISO 4217 currency code in the price. Enter the price as 0.0 to use the free shipping overlay in your ads. Use ';' to separate multiple shipping details for different regions or countries. Only people in the specified region or country will see shipping details for that region or country. You can leave out the region (keep the double '::') if your shipping details are the same for an entire country.,# Optional | The shipping weight of the item. Include the unit of measurement (lb/oz/g/kg).,# Optional | Amount of product that buyers will receive in weight or volume.,# Optional | List all of the ingredients contained in this item as found on the product label; separated by a comma.,"# Optional | The scent or fragrance of your item; including items labeled as ""unscented""","# Optional | Indicates if the item is meant to alleviate particular skin care issues. For general health concerns like obesity; or blood pressure please use the Health concerns attribute. Values may be similar to the Skin type attribute - ""dry cracked skin"" may be a cocnern but ""dry"" is a skin type.",# Optional | Describes the particular body part(s) for which the item is intended.,# Optional | Describes the particular body part(s) for which the item is intended.,# Optional | Indicates the general skin type that the product is intended for on the oily/dry spectrum.,# Optional | The consistency; texture or formulation of the item and the way it will be consumed or dispensed.,# Optional | Detailed information telling how the product should be operated; assembled; or consumed.,# Optional | Information that describes symptoms or reactions that indicate when to stop using the product.,# Optional | Indicates the strength of SPF (Sun Protection Factor) in an item. This describes how well the product can block out harmful rays from the run. Commonly found in suncreen and makeup products.,# Optional | Keywords that might be used to search for this term; including synonyms and related terms.
id,title,description,availability,condition,price,link,image_link,brand,google_product_category,fb_product_category,quantity_to_sell_on_facebook,sale_price,sale_price_effective_date,item_group_id,shipping,shipping_weight,capacity,ingredients[0],scent[0],skin_care_concern[0],body_part[0],body_part[1],skin_type,product_form,instructions[0],stop_use_indications[0],spf_value,keywords[0]
0,Soothing Milk,"This smooth feeling cleansing milk removes effectively dirt, impurities &
makeup. It calms and hydrates, alleviating dryness and leaving the
complexion feeling smooth. Gives your skin a comfortable cleanse and a
clean and soft complexion.

这平滑感觉的洁面乳有效地祛除污垢、杂质及卸妆。它镇静与保湿,
缓解干燥,让肌肤感觉柔滑。给予您的肌肤舒适的洗洁力,以及洁净

与柔软的肤色。",in stock,new,140 MYR,https://www.example.com,https://www.facebook.com/t_shirt_image_001.jpg,Girasol,Health & Beauty > Personal Care > Cosmetics,Health & Beauty > Beauty,1,,,,,10 kg,12 oz,"Helianthus Annuss (Sunflower) Seed Oil
Very high in essential fatty acids and also rich in both Vitamin A and Vitamin E. It helps
to moisturize, regenerate and condition the skin.
具有非常高的必需脂肪酸,还富含维生素 A 和维生素 E,能润泽、恢复并使皮肤
健康。

Chamomilla Recutita (Matricaria) Extract
Chamomile is a plant which has been known of since antiquity and was used by the
Egyptians as a febrifuge and to treat intestinal disorders.
自古以来,甘菊被埃及人作为退热剂及治疗肠道等疾病。
The plant has an antispasmodic action and act as a decongestant, anti-inflammatory and
anti allergic elements.
该植物具有防痉挛及减轻充血作用,也是抗炎和抗过敏的主要元素。

Cucumis Sativus (Cucumber) Fruit Extract
The cucumber has a not inconsiderable cleansing action and is suitable for even the most
sensitive skin that do not tolerate soap.
黄瓜具有惊人的洗洁能力,适合对肥皂会有不适感的非常敏感性皮肤。
Cucumber has been used for centuries as a calmative to ease minor burns and itching, and
a skin freshener and decongestant. It is also very soothing, moisturising, emollient and
softening. Its slightly astringent action is also suitable for greasy skin.
黄瓜一直以来被用为镇静剂,舒缓轻微的烫伤和瘙痒, 也用为肌肤清爽剂和减轻
充血剂。其特强洁净功能适用于超敏感肌肤。黄瓜汁紧致肌肤,提升密度。具有镇
静,滋润及柔软肤质功效。其自然收敛特性也适用于油性肌肤。

Aloe Barbadensis Leaf Juice
Aloe Vera improves hydration, is soothing and healing to all skin types. Chemical
analysis has shown the presence of mucopolysacharides, a natural moisturizing factor.
Aloe Vera is composed of water, the enzymes catalase and cellulose, minerals, calcium,
aluminium, iron, zinc, magnesium, sodium, 20 amino acids and carbohydrates. It has
renowned healing properties, anti-inflammatory and can soothe the skin and help heal
cuts, grazes, burns and insect bites. Its active constituents actually speed healing by
accelerating tissue repair and encouraging normal cell growth. These properties make it
ideal for use in skin care and cosmetic preparations on sunburns, acne dermatitis, and
otherwise sensitive and irritated skin.
独特的特质,给于干性,敏感性及损伤肌肤保湿、镇定及愈合效果。芦荟中的氨基
酸和复合多糖物质构成了天然保湿因素,它可以补充水份,恢复胶元蛋白的功能,
防止面部皱纹,保持皮肤柔润、光滑并富有弹性。芦荟中的某些成份能在皮肤上形
成一层无形的膜,具消炎、加速细胞的愈合和生长,可防止因日晒引起的红肿、灼
热感,保护皮肤免遭灼伤。

Malva Sylvestris (Mallow) Extract
It is used as skin moisturizer and emollient. It has an antiphlogistic action and therefore
excellent for treating inflammations. Their softening and soothing properties have
enabled their use in after-sun products and creams for sensitive skins.
作为肌肤保湿及滋润剂。具有消炎功效,因此对发炎皮肤有一定的疗效。柔润及镇
定功能使锦葵提取物被用于晒后产品及适合敏感肌肤使用。

Mentha Piperita (Peppermint) Oil
Its anti- inflammatory cleansing properties make it the ideal ingredient in skincare and
cosmetic preparations for oily,可振奋精神,促进血液循环。适合油性皮肤,可调节其油脂分泌,治疗暗疮,收缩
毛孔及排除毒素。

Pelargonium Graveolens Flower Oil
Emotionally uplifting, harmonizing, balancing, soothing, calming. It relieves post natal
depression and menopause problems. Used in treating acne, dermatitis and eczema.
Suitable for all skin types especially mature, inflamed and oily skin.
助身心平衡的油剂,可解除女性因妇科病而引起的情绪不安,调节荷尔蒙分泌。在
皮肤方面,它适合任何皮肤使用,具清洁、收缩毛孔、滋补功能,令[呆滞]的皮肤
组织恢复天然弹性。

Lavandula Angustifolia (Lavender) Oil
It is a popular and versatile essential oil. Lavender oil is highly regarded for its relaxing
effect on the nervous system, with an overall balancing effect on the mind and emotion. It
is used as a healing substance for wounds and burns. It is antiseptic, antibacterial and
anti-fungal. It also helps to reduce discoloration. It is also good for digestive system, the
respiratory tract and skin problems.
它是一种极为普遍使用且多功能的精油。薰衣草油对神经系统有放松作用,因此对
思绪与情绪有平衡效用。也被用作为伤口与烧伤皮肤的愈合精油。亦有杀菌和抗真
菌功能。有助于减少色素不均问题。对消化系统、呼吸道及皮肤问题亦有帮助。
As was believed in Ancient times, lavender is above all a calmative, anti-spasmodic
remedy. Lavender’s antiseptic qualities have been put to good use in surgery where it has
been used to heal various types of necrosis (infected wounds, ulcerated burn, etc).
在古时代,人们相信薰衣草具有舒缓,抗痉挛的治疗功效。其抗菌特性常被用在治
疗各种坏死疾病(伤口感染,溃疡等等)。
Used externally, lavender flower-based preparations are suitable for cleaning wounds and
sores, are antalgic in mouth infections and are calmative and refreshing on sun burns.
外用,薰衣草适合用在清洗伤口及溃疡,对于口部感染有镇痛作用,以及对晒伤则
有舒缓和清新作用。",Vanilla,Dry Skin,Eyes,Face,Oily,Oil,"Apply a thin layer to moist face and neck. Lightly massage in circular motion with
fingertips. Rinse off with water.
涂薄薄一层于湿的脸部和颈部。用指尖以打圈的方式轻轻按摩。然后,用清水洗
净。","Stop using if you experience swelling, rash, or fever",-,Solid
1,Intensive Cleasning Gel ,"This silky-soft facial wash gently and effectively foams away impurities and
dirt, leaving your skin smooth and clean. Its soothing formulation with
plants extract and essential oil helps calm visible redness, irritation skin
while preserving skin's moisture balance, leaves skin calm and refreshing
with supple complexion. The gentle formula leaves the skin perceptibly
clean, soft and supple, giving you a comfortable and healthy looking

complexion.

这丝绸般柔和的洁面凝胶温和及有效洗祛杂质和污垢,让您的肌肤光
滑与洁净。其舒缓配方含植物提取和精油有助于镇静显着的红肿、发
炎肌肤,同时保持肌肤水分的平衡,令肌肤镇静、清爽与拥有柔韧的
肤色。温和的配方使肌肤明显地干净、柔滑与柔韧。给予您舒适与健

康的肤色。",in stock,new,130 MYR,https://www.example.com,,Girasol,Health & Beauty > Personal Care > Cosmetics,Health & Beauty > Beauty,1,,,,,,,"Chamomilla Recutita (Matricaria) Extract
Chamomile is a plant which has been known of since antiquity and was used by the
Egyptians as a febrifuge and to treat intestinal disorders.
自古以来,甘菊被埃及人作为退热剂及治疗肠道等疾病。
The plant has an antispasmodic action and act as a decongestant, anti-inflammatory and
anti allergic elements.
该植物具有防痉挛及减轻充血作用,也是抗炎和抗过敏的主要元素。

Centaurea Cyanus Flower Extract
It is an astringent folk remedy that closes cutaneous pores, firms up and cleans the skin,
therefore can effectively reduce sebaceous secretions. It possesses decongestant and anti-
inflammatory properties.
是皮肤的收敛剂,用于收缩皮肤毛孔,紧实及清洁皮肤,因此能有效减少皮脂的分
泌量。具有降低充血及抗炎特性。

Malva Sylvestris (Mallow) Extract
It is used as skin moisturizer and emollient. It has an antiphlogistic action and therefore
excellent for treating inflammations. Their softening and soothing properties have
enabled their use in after-sun products and creams for sensitive skins.
作为肌肤保湿及滋润剂。具有消炎功效,因此对发炎皮肤有一定的疗效。柔润及镇
定功能使锦葵提取物被用于晒后产品及适合敏感肌肤使用。

Cucumis Sativus (Cucumber) Fruit Extract
The cucumber has a not inconsiderable cleansing action and is suitable for even the most
sensitive skin that do not tolerate soap.
黄瓜具有惊人的洗洁能力,适合对肥皂会有不适感的非常敏感性皮肤。
Cucumber has been used for centuries as a calmative to ease minor burns and itching, and
a skin freshener and decongestant. It is also very soothing, moisturising, emollient and
softening. Its slightly astringent action is also suitable for greasy skin.
黄瓜一直以来被用为镇静剂,舒缓轻微的烫伤和瘙痒, 也用为肌肤清爽剂和减轻
充血剂。其特强洁净功能适用于超敏感肌肤。黄瓜汁紧致肌肤,提升密度。具有镇
静,滋润及柔软肤质功效。其自然收敛特性也适用于油性肌肤。

Portulaca Oleracea Extract
The plant of Portulaca contains variety of nutrients such as vitamins, minerals, fatty acids
and others, plays a role as calming agent on the skin from irritation, allergy and itching, it
is also anti-inflammatory.
马齿苋植物中含有多种营养物质,包含了维他命、矿物质、脂肪酸、麸酸、天冬氨
酸及谷胱甘,让这款产品发挥绝佳减缓皮肤问题的功能,如止痒和减少过敏现象,
同时具有抗过敏及抗发炎的功效。
The plant has the following qualities: 此植物萃取具有以下效用:
 Hydrates the skin. 滋润皮肤。
 Alleviates the inflammation and is recommended for the management of inflamed
skin.
减轻炎症和被建议用于治疗发炎皮肤。
 Increases antioxidants in the skin cells and thus reduces free radical damage to the
skin.
增加皮肤细胞的抗氧化剂,从而减少自由基对皮肤的损害。
 It is safe for sensitive skin types.
适用于敏感性皮肤。

Pelargonium Graveolens Flower Oil
Emotionally uplifting, harmonizing, balancing, soothing, calming. It relieves post natal
depression and menopause problems. Used in treating acne, dermatitis and eczema.
Suitable for all skin types especially mature, inflamed and oily skin.
助身心平衡的油剂,可解除女性因妇科病而引起的情绪不安,调节荷尔蒙分泌。在
皮肤方面,它适合任何皮肤使用,具清洁、收缩毛孔、滋补功能,令[呆滞]的皮肤
组织恢复天然弹性。

Lavandula Angustifolia (Lavender) Oil
It is a popular and versatile essential oil. Lavender oil is highly regarded for its relaxing
effect on the nervous system, with an overall balancing effect on the mind and emotion. It
is used as a healing substance for wounds and burns. It is antiseptic, antibacterial and anti-fungal. It also helps to reduce discoloration. It is also good for digestive system, the
respiratory tract and skin problems.
它是一种极为普遍使用且多功能的精油。薰衣草油对神经系统有放松作用,因此对
思绪与情绪有平衡效用。也被用作为伤口与烧伤皮肤的愈合精油。亦有杀菌和抗真
菌功能。有助于减少色素不均问题。对消化系统、呼吸道及皮肤问题亦有帮助。

Mentha Piperita (Peppermint) Oil
Its anti- inflammatory cleansing properties make it the ideal ingredient in skincare and
cosmetic preparations for oily, acne-prone skin, though it is wonderfully toning and
cleansing for all skin types.
可振奋精神,促进血液循环。适合油性皮肤,可调节其油脂分泌,治疗暗疮,收缩
毛孔及排除毒素。

Citric Acid
It has been used extensively to adjust the pH level. It is said to have antioxidant
properties, protecting skin from damaging free radical activity. Citric acid is also used for
its astringent and skin lightening capabilities where it helps fade age spots.
被广泛用于调整 pH 值。有抗氧化作用,能保护皮肤免受自由基的破坏。一有收敛
及美白能力,有助于淡化斑点。",,,,,,,"Squeeze an appropriate amount of cleansing gel into your palm; add water to foam up
rich lather. Apply to face and gently massage to thoroughly clean away excess sebum and
dirt. Lastly, rinse off with water. Use morning and night.
挤适量的洁面凝胶于掌心,加水以搓成泡沫。涂于脸部及轻轻按摩以彻底洗祛多余
的皮脂和污垢。最后,用清水洗净。早晚使用。",,,
2,Intensive Cleasning Gel (Senstive Skin Type),,in stock,new,140 MYR,https://www.example.com,,Girasol,Health & Beauty > Personal Care > Cosmetics,Health & Beauty > Beauty,1,,,,,,,,,,,,,,,,,
3,Intensive Soothing Toner,"This comforting toner is formulated to restore natural pH balance and
enhance the overall clarity of your skin. A botanical blend that includes
mallow, aloe, chamomile, & cucumber tones, nourishes & moisturizes,
while oleracea extract soothe naturally. Regular use may improve skin's

suppleness and texture.

这令人舒服的爽肤水是为了恢复您肌肤自然的酸碱值平衡及增强肌肤
的清晰度而研制。混合植物萃取,其中包括锦葵,芦荟,洋甘菊及黄
瓜以均匀,滋养和润泽,而马齿苋萃取自然地舒缓您的肌肤。经常使

用可改善肌肤的柔韧度和质地。",in stock,new,108 MYR,https://www.example.com,,Girasol,Health & Beauty > Personal Care > Cosmetics,Health & Beauty > Beauty,1,,,,,,,"Hamamelis Virginiana (Witch Hazel) Extract
Its styptic properties make it as a remedy for damaged skin. This plant is also found in
make-up removers for its decongesting properties. Witch Hazel is also recommended for
slack epidermis with distended pores, mixed complexions, and sometimes for greasy
skins.
天然的肌肤收敛作用,能帮助调理肌肤油脂,协助毛孔紧致 。亦有柔软功能,增
强皮肤的防御能力及促进血液循环。

Chamomilla Recutita (Matricaria) Extract
Chamomile is a plant which has been known of since antiquity and was used by the
Egyptians as a febrifuge and to treat intestinal disorders.
自古以来,甘菊被埃及人作为退热剂及治疗肠道等疾病。
The plant has an antispasmodic action and act as a decongestant, anti-inflammatory and
anti allergic elements.
该植物具有防痉挛及减轻充血作用,也是抗炎和抗过敏的主要元素。

Aloe Barbadensis Leaf Juice
Aloe Vera improves hydration, is soothing and healing to all skin types. Chemical
analysis has shown the presence of mucopolysacharides, a natural moisturizing factor.
Aloe Vera is composed of water, the enzymes catalase and cellulose, minerals, calcium,
aluminium, iron, zinc, magnesium, sodium, 20 amino acids and carbohydrates. It has
renowned healing properties, anti-inflammatory and can soothe the skin and help heal
cuts, grazes, burns and insect bites. Its active constituents actually speed healing by
accelerating tissue repair and encouraging normal cell growth. These properties make it ideal for use in skin care and cosmetic preparations on sunburns, acne dermatitis, and
otherwise sensitive and irritated skin.
独特的特质,给于干性,敏感性及损伤肌肤保湿、镇定及愈合效果。芦荟中的氨基
酸和复合多糖物质构成了天然保湿因素,它可以补充水份,恢复胶元蛋白的功能,
防止面部皱纹,保持皮肤柔润、光滑并富有弹性。芦荟中的某些成份能在皮肤上形
成一层无形的膜,具消炎、加速细胞的愈合和生长,可防止因日晒引起的红肿、灼
热感,保护皮肤免遭灼伤。

Centaurea Cyanus Flower Extract
It is an astringent folk remedy that closes cutaneous pores, firms up and cleans the skin,

therefore can effectively reduce sebaceous secretions. It possesses decongestant and anti-
inflammatory properties.

是皮肤的收敛剂,用于收缩皮肤毛孔,紧实及清洁皮肤,因此能有效减少皮脂的分
泌量。具有降低充血及抗炎特性。

Malva Sylvestris (Mallow) Extract
It is used as skin moisturizer and emollient. It has an antiphlogistic action and therefore
excellent for treating inflammations. Their softening and soothing properties have
enabled their use in after-sun products and creams for sensitive skins.
作为肌肤保湿及滋润剂。具有消炎功效,因此对发炎皮肤有一定的疗效。柔润及镇
定功能使锦葵提取物被用于晒后产品及适合敏感肌肤使用。

Cucumis Sativus (Cucumber) Fruit Extract
The cucumber has a not inconsiderable cleansing action and is suitable for even the most
sensitive skin that do not tolerate soap.黄瓜具有惊人的洗洁能力,适合对肥皂会有不适感的非常敏感性皮肤。
Cucumber has been used for centuries as a calmative to ease minor burns and itching, and
a skin freshener and decongestant. It is also very soothing, moisturising, emollient and
softening. Its slightly astringent action is also suitable for greasy skin.
黄瓜一直以来被用为镇静剂,舒缓轻微的烫伤和瘙痒, 也用为肌肤清爽剂和减轻
充血剂。其特强洁净功能适用于超敏感肌肤。黄瓜汁紧致肌肤,提升密度。具有镇
静,滋润及柔软肤质功效。其自然收敛特性也适用于油性肌肤。

Tilia Cordata Extract
It is used internally for its antispasmodic, sudorific, stimulating, diuretic and sedative
benefits. Use externally for its lenitive (soothing), protecting and softening properties.
内服有治痉挛,排汗,激发,利尿和镇静用处。外用有止痛,防护及柔软肌肤之特
性。

Hypericum Perforatum Extract
It has been used in the popular medicine for many years as a cure for wounds, urinary
infections and disorders affecting the nervous system.
Other therapeutic effects are: digestive (ulcer relief), regulation of the menstrual cycle,
diuretic, tension-lowering, antipyretic, anti-diarrhea, anti-hemorrhoids.
是治疗伤口,尿道感染和任何影响中枢神经系统的疾病的解药。
其他治疗效果是:改善消化系统(溃疡救济) ,调理月经周期,利尿,舒缓紧绷
肌肉,解热,抗腹泻,抗痔。

Portulaca Oleracea Extract
The plant of Portulaca contains variety of nutrients such as vitamins, minerals, fatty acids
and others, plays a role as calming agent on the skin from irritation, allergy and itching, it
is also anti-inflammatory.
马齿苋植物中含有多种营养物质,包含了维他命、矿物质、脂肪酸、麸酸、天冬氨
酸及谷胱甘,让这款产品发挥绝佳减缓皮肤问题的功能,如止痒和减少过敏现象,
同时具有抗过敏及抗发炎的功效。
The plant has the following qualities: 此植物萃取具有以下效用:
 Hydrates the skin. 滋润皮肤。
 Alleviates the inflammation and is recommended for the management of inflamed
skin.
减轻炎症和被建议用于治疗发炎皮肤。
 Increases antioxidants in the skin cells and thus reduces free radical damage to the
skin.
增加皮肤细胞的抗氧化剂,从而减少自由基对皮肤的损害。
 It is safe for sensitive skin types.

Amyris Balsamifera Bark Oil
Strengthens belief, relaxing, helps in meditation, relieves tension and anxiety.
加强自信、放松、有助于冥想、缓解紧张和焦虑。
It acts as hormone adjuster, help in Inflamed, cracked dry chapped skin, mature ageing
skin, acne, blemishes, healing to scars.
在护肤方面,平衡荷尔蒙的分泌,能滋润缺水及干裂皮肤,增强皮肤的弹性,消除
粉刺、痤疮, 愈合伤疤,适合敏感及干燥皮肤。具有收敛、抗炎、抑菌及安抚特
性,对于油性及脂漏问题有帮助。

Lavandula Angustifolia (Lavender) Oil
It is a popular and versatile essential oil. Lavender oil is highly regarded for its relaxing
