It has antiseptic properties and a strong aroma that is balancing, invigorating and
revitalizing. Therefore, it is effective for mental fatigue, circulation problems, pain relief
for the muscular system, decongests the respiratory tract and is a skin and hair booster. It
also has healing, astringent and antiseptic qualities and is a scalp and skin stimulant: it
activates peripheral blood circulation and stimulates cutaneous metabolism.
具有抗菌作用及强烈的香气有平衡、醒神及提振功效。因此,对心理疲劳、循环不
良、舒缓肌肉疼痛、顺畅呼吸道有显著的功效,亦促进皮肤和头发的再生。它也具
有治疗,收敛及抗菌作用,对头皮和皮肤有刺激作用:它促进血液的循环,刺激皮
肤的新陈代谢。

Pogostemon Cablin Oil (Patchouli)
When inhaled, it is anti-depressive, aphrodisiac and mildly calming. In skin care,

Patchouli shows its strong side as a potent anti-inflammatory, anti-bacterial and anti-
fungal agent. It supports the regeneration of new cells and tissues. It is excellent for dry,

aging, wrinkled skin and for the treatment of acne, psoriasis, burn and wounds.
消炎,杀菌,它能刺激油脂分泌,帮助自然油分的补充,适合干性、皱纹皮肤,且
对消除新旧疤痕及改善脱皮有一定帮助。治疗粉刺,烧伤和伤口。",,,,,,,"Apply by rubbing in after bathing and before any kind of body oil in order to help with its
absorption and effectiveness.
洗澡后及再涂任何一 种体油之前涂擦,以帮助其吸收和有效性。",,,
10,24k Stemplus Ampoules,,in stock,new,297 MYR,https://www.example.com,,Girasol,Health & Beauty > Personal Care > Cosmetics,Health & Beauty > Beauty,1,,,,,,,,,,,,,,,,,
11,Nourishing Essence ,,in stock,new,298 MYR,https://www.example.com,,Girasol,Health & Beauty > Personal Care > Cosmetics,Health & Beauty > Beauty,1,,,,,,,,,,,,,,,,,
12,Advance Eye Essence ,"This light texture eye gel works gradually to restore skin youthful
complexion, smoothing out wrinkles and lines, removing eye puffiness and

increasing elasticity and firmness of the skin.

这款清爽质地的眼睛凝胶,能快速有效地改善眼部脆弱的肌肤、抚平
眼部的皱纹及细纹、祛除眼袋以及增加眼睛周围皮肤的弹性。",in stock,new,218 MYR,https://www.example.com,,Girasol,Health & Beauty > Personal Care > Cosmetics,Health & Beauty > Beauty,1,,,,,,,"Combination of Palmitoyl Tripeptide-1 & Palmitoyl Tetrapeptide-7
Containing matrikines which are messengers of cutaneous restructuration and repair.
They activate the neosynthesis of extracellular matrix macromecules providing a visible
anti-wrinkle efficacy.
含有 matrikines 作为皮肤的重新组织和修理。它们激活细胞基质大分子的
neosynthesis,因此具有显著的抗皱功效。
Apart from that, these messenger peptides capable of regulating cell activates by
interacting with their specific receptors. They activate certain genes involved in the
process of extracellular matrix renewal and cell proliferation.
此外,这些胜肽扮演着细胞的传达者,帮助调节细胞活动并与其结合体发挥相互作
用。它们激活了在细胞外基质重建与细胞增殖过程里的某些特定基因。

Hyaluronic Acid
It is a structural component throughout the body and often touted for its abilities to stop
or reverse aging. Its outstanding moisture retaining capacity helps skin to absorb
hydration up to approximately 1000 times of its weight. It increases the elasticity and
lubricity of the skin, promoting immediate lifting results.
这是身体结构性的一种组成部分。它具有“保湿天后”美誉、高效保湿分子:玻尿
酸有""倒流岁月""和停止老化的功效。它彻底锁住水分,预防皮肤水分的流失,让皮
肤角质层保持膨润。从而提升眼周皮肤的弹力和光滑度,有立即紧实效果。
Key benefits: 主要作用:
 It moisturizes the skin from the inside to smooth out the depth of wrinkles and
lines.
它深入滋润皮肤以抚平皱纹与细纹的深度。
 It helps to erase the signs of aging or who are beginning to see the first signs of
aging.
有助于消除初步的老化迹象。
 Immediate lifting effect helps increase firmness of the skin, to keep skin supple
and more elastic.
立即的拉提效果有助于提升皮肤的紧实度,让皮肤保持柔软、有
弹力。

Combination of Hesperidin Methyl Chalcone, Dipeptide-2 and Palmitoyl
Tetrapeptide-7
These three active molecules represent a global approach to treating puffy eyes by acting
on the physiological deficiencies.
这三个积极分子透过其修复生理缺陷的功效,有效摆平眼袋、浮肿问题。
Hesperidin methyl chalcone: 橙皮苷甲基酮
Decreases the capillary permeability 减低毛细血管通透性
Dipeptide Valyl-Tryptophane: 二肽 Valyl -色氨酸
Increases lymphatic circulation 增加淋巴循环
Lipopeptide Pal-GQPR: 脂八 GQPR:
Improves firmness and elasticity, decreases inflammatory phenomena
提高硬度和弹性,降低炎症的现象

Allantoin
It promotes cell-regeneration in skin which has been subjected to the harsh treatment of
external influences, and in addition takes care of intact facial and body skin, keeping it in

a healthy condition. Allantoin is healing, soothing and anti-irritating. It is valuable cell-
prolifering healing agent which stimulates healthy tissue formation.

曾获称为抗刺激剂,有助减轻香皂、表面活化剂,油类及酸、碱材料等所带来的
不适效应。据称可清理坏死组织,加速新的健康组织的成长,加强肌肤的自癒功
能,维持肌肤的健康。

Hydrogenated Lecithin
Lecithin is one of the most important components of a cell and plays an important role in
its metabolism, especially in its constitution and membrane penetrability. For many years
its use as a bio-surfactant in cosmetics has been studied. However, its application to
cosmetics has been limited because of its oxidation and instability against heat.
卵磷脂是细胞中最重要的组成部分之一,同时其也在细胞代谢方面发挥重要作用,
尤其是在细胞结构和膜渗透性。多年来,对它用作为化妆品中的生物表面活性剂已
进行了研究。但是由于它面对热时会氧化且不稳定性,因此使得其在化妆品中的应
用受到了限制。
Hydrogenated Lecithin retains all the good qualities of natural lecithin, yet its stability is
greatly improved. Moreover, unlike common surfactants, Hydrogenated Lecithin forms
stable liposomes when it is dispersed in water, which can be involved both water-soluble
and lipo-soluble substances.
氢化卵磷脂保留了所有天然卵磷脂的良好品质,而且其稳定性也大为提高。此外,
不同于常见的表面活性剂,当氢化卵磷脂被分散在水中时会形成稳定的脂质体,它
能够被水溶性和脂溶性物质包容。
-Natural derived emulsifier (from soy). 自然衍生乳化剂(从大豆)。
-Liposome former. 脂质体。
-Promotes percutaneous absorption of actives. 促进皮肤吸收的活性。
-Moisturizing effect. 保湿功效。
-Enhances skin barrier function. 强化肌肤屏障功能。
-Reduces skin irritation. 降低皮肤刺激性。
-Dispersant for pigments. 颜料分散剂。

Pentylene Glycol
Pentylene Glycol is an organic compound humectant used in cosmetics and beauty
products. It can have moisture-binding and antimicrobial properties (Source).
戊二醇是一种有机化合物保湿剂用于化妆品和美容产品,它有保湿及抗菌功能(来
源) 。
-Excellent skin moisturizer 卓越的保湿剂
-Reduces emulsion particle size: helps achieve better stability and improves
formulation aesthetics
降低乳状液的微粒径:帮助达到更稳定及提高研制美学
-Works synergistically with preservatives 与防腐剂互相作用(促进)的
-Enhances the bioavailability of cosmetic actives
提高了化妆品的活性生物的可效性
-Improves water-resistance of sunscreen formulations 提高耐水性的防晒配方
-Many hair care benefits 许多护发好处
-Excellent safety profile 卓越的安全性",,,,,,,"Apply a thin layer around eye area, gently massage until it is fully absorbed. Use twice
daily.
涂薄薄一层于眼睛周围,轻轻按摩直至完全被吸收。每日使用两次。",,,
13,Peptide Collagen Hydro Gel Mask,"This intensive mask contains rich skin nourishing ingredients, effectively
replenish skin moisture, and make skin moisturized. Its unique formula
technology with Beta-glucan & Hyaluronic Acid improve skin dryness, help skin
hydrating and moisturizing, leaving skin full, tender, shiny and elastic.
这款强效面膜含丰富的肌肤滋养成份, 有效补充肌肤水分, 使肌肤水润饱
满,。独特的配方技术,B-葡聚糖、玻尿酸(透明质酸钠)的运用, 改善肌肤干
燥, 有助于肌肤补水保湿修护, 使肌肤饱满、 细嫩、 光泽及有弹性。",in stock,new,33 MYR,https://www.example.com,,Girasol,Health & Beauty > Personal Care > Cosmetics,Health & Beauty > Beauty,1,,,,,,,"Hyaluronic Acid
It is a structural component throughout the body and often touted for its abilities to stop or
reverse aging. Its outstanding moisture retaining capacity helps skin to absorb hydration up
to approximately 1000 times of its weight. It increases the elasticity and lubricity of the skin,
promoting immediate lifting results.
这是身体结构性的一种组成部分。它具有“保湿天后”美誉、高效保湿分子:玻尿酸
有""倒流岁月""和停止老化的功效。它彻底锁住水分,预防皮肤水分的流失,让皮肤角
质层保持膨润。从而提升眼周皮肤的弹力和光滑度,有立即紧实效果。
Key benefits 主要作用:

- It moisturizes the skin from the inside to smooth out the depth of wrinkles and lines.
它深入滋润皮肤以抚平皱纹与细纹的深度。
- It helps to erase the signs of aging or who are beginning to see the first signs of aging. 有助于消除初步的老化迹象。
- Immediate lifting effect helps increase firmness of the skin, to keep skin supple and more elastic.
立即的拉提效果有助于提升皮肤的紧实度,让皮肤保持柔软、有弹力。

Allantoin
It promotes cell-regeneration in skin which has been subjected to the harsh treatment of
external influences, and in addition takes care of intact facial and body skin, keeping it in a

healthy condition. Allantoin is healing, soothing and anti-irritating. It is valuable cell-
prolifering healing agent which stimulates healthy tissue formation.

它促进皮肤的细胞再生,尤其是一直受到外部刺激的皮肤,此外还保护脸部和身体的
皮肤,使其保持健康状态。 尿囊素具有愈合,舒缓和抗刺激作用。 它是优越的细胞增
生修复剂,可刺激健康组织的形成。

Portulaca Oleracea Extract
The plant of Portulaca contains variety of nutrients such as vitamins, minerals, fatty acids
and others, plays a role as calming agent on the skin from irritation, allergy and itching, it is
also anti-inflammatory.
马齿苋植物中含有多种营养物质,包含了维他命、矿物质、脂肪酸、麸酸、天冬氨酸
及谷胱甘,让这款产品发挥绝佳减缓皮肤问题的功能,如止痒和减少过敏现象, 同时
具有抗过敏及抗发炎的功效。

Hamamelis Virginiana (Witch Hazel) Extract

Its styptic properties make it as a remedy for damaged skin. This plant is also found in make-
up removers for its decongesting properties. Witch Hazel is also recommended for slack

epidermis with distended pores, mixed complexions, and sometimes for greasy skins.
天然的肌肤收敛作用,能帮助调理肌肤油脂,协助毛孔紧致 。亦有柔软功能,增强皮
肤的防御能力及促进血液循环。

Panthenol
It is a non-irritating form of Pro-vitamin B5, acts as skin humectant, emollient and moisturizer. It has a good skin penetration where it penetrates into lower skin layers, and quickly absorbed by the skin cell to improve hydration. 无刺激性的维它命原 B-5,作为皮肤的保湿剂及滋润剂。具有良好的渗透力能直达皮肤
最底层,并很快地被皮肤细胞吸收以改善水分循环。
On the other hand, it has been used to treat sunburn, reduce itching and inflammation of the
skin (it counteracts surface bacteria), as well as accelerate and improve healing of epidermal
wound (it improves normal keratinization and stimulates epithelization – rebuilding of our
skin). 除此之外,也被用来治疗晒伤皮肤,舒缓瘙痒及发炎状况(对抗表面细菌),促进及
改善表皮细胞的修复及伤口的愈合(促进皮肤的正常角质化和表皮的重建)。

Its long lasting moisturizing effect enables the dry skin to remain supple and elastic and help
diminish the wrinkles and lines by infusing moisture into the deepest layers of our skin.
其长效保湿作用让干燥皮肤处于柔软,有弹力的状态,并透过深层水分的供给来抚平
皱纹与细纹。

Acetyl Hexapeptide-8
It is a peptide specially designed to fight against expressions wrinkles and counteracts
against deep lines or wrinkles caused by the repeated movements, especially in the
forehead and around the eyes.
胜肽,专为对抗、打击反复动作造成的表情纹及皱纹而设,尤其是在前额及眼睛周围
部位。
It is a safer, cheaper, and milder alternative to Botulinum Toxin, topically targeting the same
wrinkles-formation mechanism in a very different. As a result, effectively and progressively
improves aging skin and its texture, and static and dynamic wrinkles.
它提供比肉毒杆菌更安全、便宜及温和的抗皱效果,采用不同的方式专注于相同的皱
纹形成机制。因此,它能有效并渐进式的改善肌肤老化情况及其纹理,静态及动态皱
纹。

Beta-glucan
Beta-glucan is produced by applying liquid cultivation & Bio-conversion technology to the
mycelium of a mushroom species ‘Schizophyllum Commune’. Its major component is a
highly water-soluble polymer, provides moisturizing effect and improves skin dryness.
ß-葡聚糖,是从 ‘Schizophyllum commune’ 蘑菇类的 mycelium 培植液和经由生化
转化科技而得,具有保湿效果, 改善干燥肌肤。Beta-Glucan 促进细胞的增生, 对伤
口的愈合、 烧伤和晒伤有显著的效果。它亦提供抗敏和增加免疫系统的防疫能力。
Efficacy 功能:

- Moisturizing effect. 保湿效果。
- Skin dryness improvement. 改善干燥肌肤。
- Healing of psoriasis and burn. 愈合牛皮癣(psoriasis)和烧伤。
- Sun burn protection and cure. 保护和治疗晒伤。
- Promotion of skin penetration. 促进伤口的愈合。
- Promotion of would heal. 促进皮肤的渗透力。
- Anti-irritation. 抗敏感。

Collagen
The collagen used in this product is abstracted from fish scales and fish skins, using
advanced biotechnological directed enzymolysis technology. It supplies 18 kinds beneficial
amino acids, reinforcing skin collagen’s activity. It maintains the moisture of horny layer and
fiber structure’s integrity so as to promote skin tissue’s metabolism.
这产品使用从鱼鳞和鱼皮萃取而提炼的胶原,利用先进的生物酶解技术指导。它提供
有益的18种氨基酸,增强皮肤胶原蛋白的活动。它保持水分的角质层和纤维结构的完
整性,以促进皮肤组织的新陈代谢。

It has the following characteristics: 它具有以下特点:

1. Trophism 滋养
This collagen supplies 18 kinds of beneficial amino acids, reinforcing skin collagen’s activity. It also helps in maintaining the moisture of horny layer and fiber structure’s integrity, to
promote the metabolism of skin. It achieves the efficiencies as moistening skin and wrinkle chasing.
这款胶原提供18种有益的氨基酸,加强肌肤的胶原蛋白活跃性。也有助于维持角质层
的水分以及纤维结构的完整性,促进皮肤的新陈代谢。因此,具有高效保湿力和祛皱
功效。
2. Molding moisture 水分供应
Containing a lot of hydrophilic groups, can intensely absorb water in the air and form a
hydration shell to mold moisture.
含有大量亲水性基团,能从空气中吸取水分并形成一层保湿膜,给予皮肤源源不绝的
水分。
3. Whitening 美白
It may prevent tyrosinase which result in melanin, eliminate free radicals in body, anti
oxygenation, promote cell’s metabolism and postpone cell’s aging. Thereby, it makes human skin soft, elastic, and obviously whiten.
能抑制产生麦拉宁的酪氨酸酶,消除自由基,反氧合作用,促进细胞的新陈代谢以及
延缓细胞老化。
4. Removing wrinkles 祛除皱纹
Due to ability of molding moisture, it provides essential elements for collagen’s synthesis,
vastly postponing skin senility and reducing wrinkles.
其保湿功效提供了胶原蛋白合成所需要素,大大延缓皮肤的衰老,减少皱纹的形成。
5. Removing shadows undereyes and puffiness 除黑眼圈和眼袋
Tightens skin under and around the eyes, and achieve removing effect.
紧实眼部周围肌肉以达到祛除黑眼圈及眼袋效果。

Trehalose
Trehalose is a naturally occurring saccharide present in wide variety of plant and animal life,
enabling survival in the harshest climatic conditions.
海藻糖是一种天然存在于多种植物及动物,让它们能够生存在极恶劣的环境中,如它
能保护某些抗旱植物在枯燥期不受损害。
Trehalose protects skin fibroblasts from dehydration because it replaces water in tissues
helping to retain the natural structure of skin. Thus it can be used as an effective moisturizer
affording protection from potentially damaging climatic conditions.
海藻糖亦具有保护人体纤维细胞对抗缺水现象,同时更替细胞内流失的水分以保留皮
肤的自然结构。因此,常作为有效的保湿剂,帮助处于恶劣环境压力中的皮肤对抗水
分流失,以保持水嫩肌肤。",,,,,,,"After cleansing, open the packaging bag and take out the mask, carefully unfold it, apply it
to the face for 15-20 minutes after adjustment.
洁面后, 打开包装袋取出面膜, 小心展开,调整好后敷于面部15-20分钟即可。
Suitable for skin oily, dry, combination and sensitive skin.
适合用于油性,干性,混合性和敏感性肌肤。","If the essence is inadvertently into the eyes, please wash it with water immediately. If
the skin sensitive, please do a partial skin sensitivity test before use. Prevent children from
wrong catching food and eating, so as not to cause unnecessary harm.
温馨提示: 使用时精华液如不慎入眼,请立即用清水清洗; 皮肤敏感者, 使用前请先做局
部皮肤敏感性测试。避免儿童抓拿误食, 以免造成不必要的伤害。",,
14,Ultra Repairing Bio Cellulose Mask,"This light textured and quick-absorbing bio-cellulose fibers mask with its unique formula
provides intense & long-lasting moisture to improve skin firmness and elasticity and also
smoothing the wrinkles & fine lines, provide repairing effect, while also has soothing &
calming effects. After usage, will let you have a soft, youthful and healthy skin. Addition,
it also imparts suppleness and smoothness of skin without unpleasant greasy feel, leaves
skin smooth, hydrated, and comfortable. The bio-cellulose fibers make these masks ideal
for both donating and absorbing liquids and moisture. This means that they are perfect for
assisting with all skin types, ensuring your skin gets the nourishment it needs in order to
flourish.
这款质地轻盈、吸收迅速的生物纤维素纤维面膜以其独特的配方提供强效持久的水
分,改善皮肤紧致度与弹性,抚平皱纹和细纹,提供修复效果,同时还具有舒缓与
镇静作用。 使用后,让您拥有柔滑、年轻、健康的肌肤。 此外,它还赋予皮肤柔
韧和光滑的感觉,没有不悦的油腻感,使皮肤光滑、水润与舒适。生物纤维素纤维
面膜成为捐赠及吸收液体与水分的理想选择。 这意味着它们非常适合帮助所有类
型的皮肤,确保您的皮肤获得所需的营养以促进活力。",in stock,new,55 MYR,https://www.example.com,,Girasol,Health & Beauty > Personal Care > Cosmetics,Health & Beauty > Beauty,1,,,,,,,"Hyaluronic Acid
Hyaluronic Acid is often touted for its ability to “reserve” or stop aging. In news report,
you might have heard of all of these miraculous contributions of Hyaluronic Acid to
human skin. In real fact, Hyaluronic Acid is a valuable ingredient in cosmetic; it is
marked to have an extremely high capacity to retain moisture. This is higher than any
substances known, and remains unchallenged even in low humidity. This is particularly
important since the skin tends to dry up in an atmosphere of low humidity. Due to that of
it is a large molecule, it does not penetrate deeply into the skin, instead, Hyaluronic Acid
forms a highly moisture retaining film on the skin, which is permeable to light and air. It
is invisible, not sticky and in no way obstructs the skin ability to breathe, and leaves skin
smooth and supple.
玻尿酸因其有""倒流岁月""和停止老化的功效,常被当成护肤品中不可缺少的一角。
新闻也常报导有关玻尿酸对人体皮肤的神奇""造化""。玻尿酸是有价值的化妆品成
分,有保持高度滋润能力。它的保湿度远远超越其他物质,它既有独特提升干性皮
肤的保湿能力。它既有较大的分子,故不能深入渗透肌肤,而形成一层对光和空气
有渗透性的薄膜,使皮肤有紧实效果。它是无形且不含粘性,让肌肤毫无阻碍的呼
吸,使肌肤更加光滑柔顺。玻尿酸是皮肤蛋白质的一种,是最佳保湿持有者,能够
锁住本身重量一千倍的水分。玻尿酸可保持水分,同时能维持皮肤的润滑性与柔软性。具有极强的吸水性,被喻为保湿天后,可在肌肤表面形成强力水磁场,提供肌肤全天24小时足够的保湿能力。

Hyaluronic Acid is a component of connective tissues of the body, or it can be said that it
naturally presents in our skin, but as we age, the amount of Hyaluronic Acid in the skin
starts to drop. Consequently, skin losses its elasticity and lackluster, even the formation
of wrinkles will start to aggravate. So as to counteract the effects of aging, it has become
more and more popular.
玻尿酸是一种覆盖在某些结缔组织上的物质,帮助锁主水分。但随着年龄的增长,
在人体皮肤内的玻尿酸会逐渐流失。皮肤会因此失去弹性和光泽,甚至因缺乏水分
而产生皱纹。正因如此,在对抗皮肤老化这方面,玻尿酸有绝对的""返老""能力。
It in actual fact works in hydrating and moisturizing the skin from the inside and with this
helps to smooth out wrinkles. Apart from moisturizing and hydrating plus smoothing out
wrinkles, the increase of hydration in the skin is of essential importance, as this helps
getting nutrition to the cells, as well as providing the vehicle for proper waste removal
from skin cells, it is so helps to increase the amount of water held in the extracellular
matrix of the skin.
实际上,玻尿酸能深入滋润皮肤、提供皮肤所需的水分,扶平脸上细纹。除了极佳
的保湿及抗皱效果外,提升肌肤的湿润度尤其重要。一旦皮肤得到充裕的水分与滋
润后,肌肤细胞便能得到滋养,并帮助肌肤细胞能适当的排除废物。不仅如此,玻
尿酸也能提升皮肤细胞外的基质,给予充足的水分。
Overall, Hyaluronic Acid is an attractive ingredient that used for cosmetic application
because of its excellent property of moisturization to give lubricity to the human skin,
utilizing water absorption and water holding properties. It softens and returns elasticity to
skin exposed to sun radiation and, it is a very effective protection and regenerator in
processes of ageing, traumatisms and metabolic disorders. It is non toxic, non irritating
and non sensitizing as well, so it can be used on all skin types.
在美容界,玻尿酸可算是最具吸引力的美容圣品。因为玻尿酸具有绝佳的保湿功
能,让肌肤呈现细致的光泽,加强肌肤的锁水能力。玻尿酸更具有""保湿天后""的美
誉。它保持遭阳光辐射侵害肌肤的柔软度与弹性,非常有效的对抗老化、延缓老化
过程,保护表皮促进新陈代谢,让肌肤更健康亮丽。玻尿酸无毒、不造成刺激和敏
感。适合所有肌肤使用。

It is a structural component throughout the body and often touted for its abilities to stop
or reverse aging. Its outstanding moisture retaining capacity helps skin to absorb
hydration up to approximately 1000 times of its weight. It increases the elasticity and
lubricity of the skin, promoting immediate lifting results.
它是身体结构性的一种组成部分。它具有“保湿天后”美誉、高效保湿分子:玻尿
酸有""倒流岁月""和停止老化的功效。它彻底锁住水分,预防皮肤水分的流失,让皮
肤角质层保持膨润。从而提升眼周皮肤的弹力和光滑度,有立即紧实效果。

Key benefits 主要作用:
- It moisturizes the skin from the inside to smooth out the depth of wrinkles and
lines.
它深入滋润皮肤以抚平皱纹与细纹的深度。
- It helps to erase the signs of aging or who are beginning to see the first signs of
aging.
有助于消除初步的老化迹象。
- Immediate lifting effect helps increase firmness of the skin, to keep skin supple
and more elastic.
立即的拉提效果有助于提升皮肤的紧实度,让皮肤保持柔软、有弹力。

Allantoin
It promotes cell-regeneration in skin which has been subjected to the harsh treatment of
external influences, and in addition takes care of intact facial and body skin, keeping it in

